{
  "$schema": "https://json-schema.org/draft/2020-12/schema",
  "$id": "https://neoslegal.co/schemas/vasp-license-record.schema.json",
  "title": "UAE VASP License Record",
  "description": "A single record describing a licensed or regulated virtual asset entity in the UAE, as maintained by the NeosLegal UAE VASP License Tracker.",
  "type": "object",
  "additionalProperties": false,
  "required": [
    "entity_name",
    "regulator",
    "jurisdiction",
    "status",
    "last_checked"
  ],
  "properties": {
    "entity_name": {
      "type": "string",
      "description": "Legal name of the licensed/regulated entity.",
      "minLength": 1
    },
    "trade_name": {
      "type": ["string", "null"],
      "description": "Trading or brand name, if different from the legal name."
    },
    "regulator": {
      "type": "string",
      "description": "Regulator that issued or oversees the licence.",
      "enum": ["VARA", "FSRA", "DFSA", "CBUAE", "SCA"]
    },
    "jurisdiction": {
      "type": "string",
      "description": "UAE jurisdiction or free zone (e.g. Dubai, ADGM, DIFC, UAE federal).",
      "minLength": 1
    },
    "license_type": {
      "type": ["string", "null"],
      "description": "Category or class of licence/permission held."
    },
    "licensed_activities": {
      "type": ["string", "null"],
      "description": "Virtual asset activities the entity is permitted to perform. Multiple values may be separated by a semicolon."
    },
    "status": {
      "type": "string",
      "description": "Current standing of the licence/permission.",
      "examples": ["active", "suspended", "withdrawn", "in-principle approval"],
      "minLength": 1
    },
    "license_date": {
      "type": ["string", "null"],
      "description": "Date the licence was issued or became effective. Preferred format is ISO 8601 YYYY-MM-DD where an exact date is available; a year-only value YYYY is valid where only the year is known. Month and day are never invented.",
      "pattern": "^[0-9]{4}(-[0-9]{2}-[0-9]{2})?$"
    },
    "official_website": {
      "type": ["string", "null"],
      "description": "The record's single approved URL, taken verbatim from the source workbook. It may point to the entity's own website, an official announcement, a regulator page, or another approved source. No URL is inferred or generated.",
      "format": "uri"
    },
    "last_checked": {
      "type": "string",
      "description": "Date the record was last verified against the source (ISO 8601).",
      "format": "date"
    },
    "notes": {
      "type": ["string", "null"],
      "description": "Additional context or clarifications."
    }
  }
}
