[
  {
    "entity_name": "Revolut Stored Value Services L.L.C",
    "trade_name": null,
    "regulator": "CBUAE",
    "jurisdiction": "United Arab Emirates (federal)",
    "license_type": "Money Services",
    "licensed_activities": "Stored Value Facility ; Retail Payment Services",
    "status": "Listed in public register",
    "license_date": "2026-06-01",
    "official_website": "https://www.revolut.com/en-FI/news/revolut_obtains_approval_for_stored_value_facilities_and_retail_payment_services_licences_from_the_central_bank_of_the_uae/",
    "last_checked": "2026-07-31",
    "notes": null
  },
  {
    "entity_name": "Flipster FZE",
    "trade_name": null,
    "regulator": "VARA",
    "jurisdiction": "Dubai",
    "license_type": "Exchange",
    "licensed_activities": "Exchange Services",
    "status": "Listed in public register",
    "license_date": "2026-07-01",
    "official_website": "https://www.flipster.io/",
    "last_checked": "2026-07-31",
    "notes": null
  },
  {
    "entity_name": "BTCS (MIDDLE EAST) LTD (Bitcoin Suisse)",
    "trade_name": null,
    "regulator": "FSRA",
    "jurisdiction": "Abu Dhabi Global Market (ADGM)",
    "license_type": "Bank",
    "licensed_activities": "Dealing in Investments as Agent ; Dealing in Investments as Principal (Matched) ; Providing Custody",
    "status": "Listed in public register",
    "license_date": "2026-07-01",
    "official_website": "https://bitcoinsuisse.com/",
    "last_checked": "2026-07-31",
    "notes": null
  },
  {
    "entity_name": "Tribe Tokenisation FZE",
    "trade_name": null,
    "regulator": "VARA",
    "jurisdiction": "Dubai",
    "license_type": "Broker-dealer",
    "licensed_activities": "Broker-Dealer Services",
    "status": "Listed in public register",
    "license_date": "2026-06-01",
    "official_website": "https://tribeinvest.co/",
    "last_checked": "2026-07-31",
    "notes": null
  },
  {
    "entity_name": "YHEGO Virtual Assets Exchange Service L.L.C (Yhego Technology Investment L.L.C)",
    "trade_name": null,
    "regulator": "VARA",
    "jurisdiction": "Dubai",
    "license_type": "Broker-dealer",
    "licensed_activities": "Broker-Dealer Services",
    "status": "Listed in public register",
    "license_date": "2026-06-01",
    "official_website": "https://yhego.ae/",
    "last_checked": "2026-07-31",
    "notes": null
  },
  {
    "entity_name": "YHEGO Virtual Assets Exchange Service L.L.C (Yhego Technology Investment L.L.C)",
    "trade_name": null,
    "regulator": "VARA",
    "jurisdiction": "Dubai",
    "license_type": "Exchange",
    "licensed_activities": "Exchange Services",
    "status": "Listed in public register",
    "license_date": "2026-06-01",
    "official_website": "https://yhego.ae/",
    "last_checked": "2026-07-31",
    "notes": null
  },
  {
    "entity_name": "Maerki Baumann &Co. Ltd. (ADGM Branch)",
    "trade_name": null,
    "regulator": "FSRA",
    "jurisdiction": "Abu Dhabi Global Market (ADGM)",
    "license_type": "Bank",
    "licensed_activities": "Arranging Deals in Investments ; Arranging Custody",
    "status": "Listed in public register",
    "license_date": "2026-01-15",
    "official_website": "https://www.archip.ch/en/archip-corporate",
    "last_checked": "2026-07-31",
    "notes": null
  },
  {
    "entity_name": "JINGDONG COINLINK TECHNOLOGY (MIDDLE EAST) LIMITED (JD Stablecoin)",
    "trade_name": null,
    "regulator": "FSRA",
    "jurisdiction": "Abu Dhabi Global Market (ADGM)",
    "license_type": "Issuance",
    "licensed_activities": "Issuing a Fiat - Referenced Token",
    "status": "Listed in public register",
    "license_date": "2026-01-01",
    "official_website": "https://corporate.jd.com/",
    "last_checked": "2026-07-31",
    "notes": null
  },
  {
    "entity_name": "BITEXEN MENA LTD",
    "trade_name": null,
    "regulator": "FSRA",
    "jurisdiction": "Abu Dhabi Global Market (ADGM)",
    "license_type": "Exchange",
    "licensed_activities": "Operating a Multilateral Trading Facility",
    "status": "Listed in public register",
    "license_date": "2026-05-01",
    "official_website": "https://global.bitexen.com/",
    "last_checked": "2026-07-31",
    "notes": null
  },
  {
    "entity_name": "BITEXEN CUSTODY LTD",
    "trade_name": null,
    "regulator": "FSRA",
    "jurisdiction": "Abu Dhabi Global Market (ADGM)",
    "license_type": "Custody",
    "licensed_activities": "Providing Custody",
    "status": "Listed in public register",
    "license_date": "2026-05-01",
    "official_website": "https://global.bitexen.com/",
    "last_checked": "2026-07-31",
    "notes": null
  },
  {
    "entity_name": "Daman Virtual Asset Brokerage LLC",
    "trade_name": null,
    "regulator": "VARA",
    "jurisdiction": "Dubai",
    "license_type": "Broker-dealer",
    "licensed_activities": "Broker-Dealer Services",
    "status": "Listed in public register",
    "license_date": "2026-04-01",
    "official_website": "https://damanvirtual.com/",
    "last_checked": "2026-07-31",
    "notes": null
  },
  {
    "entity_name": "Liquidity Fintech FZE (LTP group)",
    "trade_name": null,
    "regulator": "VARA",
    "jurisdiction": "Dubai",
    "license_type": "Broker-dealer",
    "licensed_activities": "Broker-Dealer Services",
    "status": "Listed in public register",
    "license_date": "2026-04-01",
    "official_website": "https://www.liquiditytech.com/en/ae",
    "last_checked": "2026-07-31",
    "notes": null
  },
  {
    "entity_name": "First Crypto Exchange L.L.C (First Crypto)",
    "trade_name": null,
    "regulator": "VARA",
    "jurisdiction": "Dubai",
    "license_type": "Broker-dealer",
    "licensed_activities": "Broker-Dealer Services",
    "status": "Listed in public register",
    "license_date": "2026-04-01",
    "official_website": "https://fce.global/",
    "last_checked": "2026-07-31",
    "notes": null
  },
  {
    "entity_name": "CoinCorner Virtual Assets Broker & Dealer Services L.L.C.",
    "trade_name": null,
    "regulator": "VARA",
    "jurisdiction": "Dubai",
    "license_type": "Broker-dealer",
    "licensed_activities": "Broker-Dealer Services",
    "status": "Listed in public register",
    "license_date": "2026-05-01",
    "official_website": "https://www.coincorner.com/",
    "last_checked": "2026-07-31",
    "notes": null
  },
  {
    "entity_name": "Foris DAX Middle East FZE (Crypto.com)",
    "trade_name": null,
    "regulator": "CBUAE",
    "jurisdiction": "United Arab Emirates (federal)",
    "license_type": "Money Services",
    "licensed_activities": "Stored Value Facility",
    "status": "Listed in public register",
    "license_date": "2026-05-01",
    "official_website": "https://crypto.com/ae",
    "last_checked": "2026-07-31",
    "notes": null
  },
  {
    "entity_name": "AED StableCoin L.L.C - S.P.C (AE Coin)",
    "trade_name": null,
    "regulator": "CBUAE",
    "jurisdiction": "United Arab Emirates (federal)",
    "license_type": "Issuance",
    "licensed_activities": "Dirham Payment Token Issuance",
    "status": "Listed in public register",
    "license_date": "2024",
    "official_website": "https://aecoin.com/index.php",
    "last_checked": "2026-07-31",
    "notes": null
  },
  {
    "entity_name": "AEDC Stable Coin Network And Distribution - L.L.C (DDSC)",
    "trade_name": null,
    "regulator": "CBUAE",
    "jurisdiction": "United Arab Emirates (federal)",
    "license_type": "Issuance",
    "licensed_activities": "Stored Value Facility ; Payment Token Conversion ; Payment Token Custody and Transfer",
    "status": "Listed in public register",
    "license_date": "2026",
    "official_website": "https://www.ihcuae.com/media-centre/press-releases/ihc-sirius-and-fab-receive-central-bank-approval-to-launch-uae-dirham-backed-stablecoin-ddsc-on-adi-chain?trk=public_post_comment-text",
    "last_checked": "2026-07-31",
    "notes": null
  },
  {
    "entity_name": "AEDC Stable Coin-L.L.C (DDSC)",
    "trade_name": null,
    "regulator": "CBUAE",
    "jurisdiction": "United Arab Emirates (federal)",
    "license_type": "Issuance",
    "licensed_activities": "Dirham Payment Token Issuance",
    "status": "Listed in public register",
    "license_date": "2026",
    "official_website": "https://www.ihcuae.com/media-centre/press-releases/ihc-sirius-and-fab-receive-central-bank-approval-to-launch-uae-dirham-backed-stablecoin-ddsc-on-adi-chain?trk=public_post_comment-text",
    "last_checked": "2026-07-31",
    "notes": null
  },
  {
    "entity_name": "Amber Premium FZE",
    "trade_name": null,
    "regulator": "VARA",
    "jurisdiction": "Dubai",
    "license_type": "Asset Management / Fund",
    "licensed_activities": "Management and Investment Services",
    "status": "Listed in public register",
    "license_date": "2026-04-01",
    "official_website": "https://www.ambr.io/uae",
    "last_checked": "2026-07-31",
    "notes": null
  },
  {
    "entity_name": "Amber Premium FZE",
    "trade_name": null,
    "regulator": "VARA",
    "jurisdiction": "Dubai",
    "license_type": "Broker-dealer",
    "licensed_activities": "Broker-Dealer Services",
    "status": "Listed in public register",
    "license_date": "2026-04-01",
    "official_website": "https://www.ambr.io/uae",
    "last_checked": "2026-07-31",
    "notes": null
  },
  {
    "entity_name": "Amber Premium FZE",
    "trade_name": null,
    "regulator": "VARA",
    "jurisdiction": "Dubai",
    "license_type": "Lending & Borrowing",
    "licensed_activities": "Lending and Borrowing Services",
    "status": "Listed in public register",
    "license_date": "2026-04-01",
    "official_website": "https://www.ambr.io/uae",
    "last_checked": "2026-07-31",
    "notes": null
  },
  {
    "entity_name": "AMINA Bank AG",
    "trade_name": null,
    "regulator": "FSRA",
    "jurisdiction": "Abu Dhabi Global Market (ADGM)",
    "license_type": "Bank",